{
  "$schema": "./release.schema.json",
  "schema_version": 2,
  "release": "v2-test100",
  "measured_at": "2026-09-01",
  "result": {
    "dataset": "LongMemEval-S test100",
    "questions": 100,
    "accuracy": 72.0,
    "median_context_tokens": 574,
    "naive_rag_accuracy": 65.0,
    "naive_rag_median_context_tokens": 12763,
    "full_context_accuracy": 86.0,
    "full_context_median_context_tokens": 109059,
    "vs_naive_rag_p_value": 0.3368,
    "significant_vs_naive_rag": false,
    "one_shot": true,
    "baseline_run_on_heldout": false
  },
  "engineering": {
    "verified_at": "2026-10-20",
    "tests": 2313,
    "line_coverage": 89,
    "ci_platforms": [
      "ubuntu",
      "windows",
      "macos"
    ],
    "measured_tree_sha256": "8a6ab617f0ac2e8a16353bed7b431c845b66e5632f3267b8162fcdfcfcbfc99b",
    "source_commit_for_reference": "15622f00ac",
    "document_checks": 356
  },
  "regression": {
    "experiment": "original-test100-v2-t4-dispatch-v1",
    "evidence_class": "exposed-regression",
    "questions": 100,
    "repeats_per_arm": 3,
    "control_correct": [
      70,
      68,
      68
    ],
    "candidate_correct": [
      86,
      87,
      85
    ],
    "control_accuracy": 68.66666666666667,
    "candidate_accuracy": 86.0,
    "mean_difference_pp": 17.33333333333333,
    "control_recorded_tokens": 476864,
    "candidate_recorded_tokens": 2465965,
    "reader_rows": 600,
    "grade_rows": 600,
    "gate_passed": true,
    "gate_path": "results/analysis/original-test100-v2-t4-dispatch-v1.gate.json",
    "gate_sha256": "b6ab8ad8681f3828d1a37f08cd85cc5584dc4907554e9ac5891c9b527e6ca2e1",
    "audit_path": "results/analysis/original-test100-v2-t4-dispatch-v1.completion-audit-v1.json",
    "audit_sha256": "a8f4516ea5b6deafcde31340ac4a119949363938821ca0ebf1d2ed9009097d49"
  }
}
